<?xml version="1.0" encoding="UTF-8"?>
<concesionario xmlns:xsi="http://www.w3.org/2001/XMLSchema-instance"
xsi:noNamespaceSchemaLocation="ConcesionarioMejorado.xsd">
    <Nombre>Toyota SAC </Nombre>
    <ciudad> Madrid </ciudad>
    <informe_ventas>
        <venta>
            <empleado id= "45"> 
                <nombre> Pepito  </nombre>
                <apellido> Juarez </apellido>
                <edad> 32 </edad>
                <DNI> 41813658D </DNI>
                <teléfono> 6485639 </teléfono>
                <fecha_incorporacion>2021-05-02</fecha_incorporacion>
            </empleado>
            <cliente codigo="COD143">
                <nombres> Moises Jesus</nombres>
                <apellidos> Morales Duarez </apellidos>
                <NIE> 85478963C</NIE>
                <telef> 6541258</telef>
                <NSS> "" </NSS>
                <direccion> Prado 39 </direccion>
                <poblacion> Ubrique </poblacion>
                <codigoPostal> 11600 </codigoPostal>
                <fecha_nacimiento> 1983-05-20 </fecha_nacimiento>
            </cliente>
            <coche>
                <matricula> 1111-BAB </matricula>
                <marca> Renault </marca>
                <modelo> Passat </modelo>
                <cilindrada> 1.4 </cilindrada>
                <potencia> 82</potencia>
                <color> grismar10 </color>
                <motor> diesel </motor>
                <fechaFabricacion> 1990-12-25 </fechaFabricacion>
                <precio> 7500.10</precio>
            </coche>
            <formaPago> efectivo</formaPago>
            <observaciones> El coche tiene algunos defectos </observaciones>
            <opcionGarantia> sí </opcionGarantia>
        </venta>
    </informe_ventas>
</concesionario>